Symbol,Name,Last Sale,Net Change,% Change,Market Cap,Country,IPO Year,Volume,Sector,Industry
PCAR,PACCAR Inc. Common Stock,$84.56,1.55,1.867%,29356982028.00,United States,,1043328,Capital Goods,Auto Manufacturing
PCG,Pacific Gas & Electric Co. Common Stock,$10.705,0.185,1.759%,21252347979.00,United States,,12068271,Public Utilities,Power Generation
PCH,PotlatchDeltic Corporation Common Stock,$52.205,0.265,0.51%,3500100722.00,United States,,117380,Consumer Services,Real Estate Investment Trusts
PCI,PIMCO Dynamic Credit and Mortgage Income Fund Common Shares of Beneficial Interest,$21.3499,-0.1601,-0.744%,3248067037.00,,2013,225903,Finance,Investment Managers
PCOR,Procore Technologies Inc. Common Stock,$92.63,0.50,0.543%,12146610341.00,,2021,65904,Technology,EDP Services
PCRX,Pacira BioSciences Inc. Common Stock,$47.90,-0.72,-1.481%,2129384537.00,United States,2011,178616,Health Care,Biotechnology: Pharmaceutical Preparations
PCTY,Paylocity Holding Corporation Common Stock,$276.73,-3.74,-1.333%,15109854831.00,United States,2014,105240,Technology,Computer Software: Prepackaged Software
PD,PagerDuty Inc. Common Stock,$39.92,-0.93,-2.277%,3392100803.00,,2019,389140,Technology,Retail: Computer Software & Peripheral Equipment
PDCE,PDC Energy Inc. Common Stock (Delaware),$48.51,0.95,1.997%,4785976614.00,United States,,451008,Energy,Oil & Gas Production
PDCO,Patterson Companies Inc. Common Stock,$33.03,0.52,1.60%,3214545660.00,United States,1992,315880,Health Care,Medical Specialities
PDD,Pinduoduo Inc. American Depositary Shares,$96.385,1.435,1.511%,120798241084.00,China,2018,5576840,Miscellaneous,Business Services
PDM,Piedmont Office Realty Trust Inc. Class A Common Stock,$18.345,0.335,1.86%,2277264408.00,United States,,349101,Consumer Services,Building operators
PEAK,Healthpeak Properties Inc. Common Stock,$33.78,0.00,0.00%,18206351606.00,United States,,713880,Consumer Services,Real Estate Investment Trusts
PEB,Pebblebrook Hotel Trust Common Shares of Beneficial Interest,$22.78,0.02,0.088%,2992893692.00,United States,2009,2185560,Consumer Services,Real Estate Investment Trusts
PECO,Phillips Edison & Company Inc. Common Stock,$31.37,-0.11,-0.349%,3554221000.00,United States,2021,44762,Consumer Services,Real Estate Investment Trusts
PEG,Public Service Enterprise Group Incorporated Common Stock,$60.275,-0.185,-0.306%,30473658015.00,United States,,604286,Public Utilities,Electric Utilities: Central
PEGA,Pegasystems Inc. Common Stock,$125.19,-1.26,-0.996%,10197435578.00,United States,1996,34924,Technology,EDP Services
PEN,Penumbra Inc. Common Stock,$256.25,-5.35,-2.045%,9373763375.00,,2015,33139,Health Care,Medical/Dental Instruments
PENN,Penn National Gaming Inc. Common Stock,$73.48,-1.62,-2.157%,11520877397.00,United States,1994,3022281,Consumer Services,Movies/Entertainment
PEP,PepsiCo Inc. Common Stock,$156.5498,0.1598,0.102%,216454041696.00,United States,,2172945,Consumer Non-Durables,Beverages (Production/Distribution)
PFE,Pfizer Inc. Common Stock,$42.595,-0.145,-0.339%,238816890524.00,United States,,7683253,Health Care,Biotechnology: Pharmaceutical Preparations
PFG,Principal Financial Group Inc Common Stock,$68.99,1.02,1.501%,18516509787.00,United States,2001,1006393,Finance,Specialty Insurers
PFGC,Performance Food Group Company Common Stock,$47.90,-0.54,-1.115%,6420675794.00,United States,2015,558590,Consumer Non-Durables,Food Distributors
PFSI,PennyMac Financial Services Inc. Common Stock,$62.67,0.10,0.16%,3889039555.00,United States,2013,268125,Finance,Finance: Consumer Services
PG,Procter & Gamble Company (The) Common Stock,$141.925,-0.395,-0.278%,344638701039.00,United States,,3226422,Consumer Non-Durables,Package Goods/Cosmetics
PGNY,Progyny Inc. Common Stock,$58.53,-0.50,-0.847%,5232214900.00,United States,2019,144341,Health Care,Managed Health Care
PGR,Progressive Corporation (The) Common Stock,$91.10,-0.04,-0.044%,53320830000.00,United States,,1227290,Finance,Property-Casualty Insurers
PGRE,Paramount Group Inc. Common Stock,$9.305,0.135,1.472%,2037432105.00,United States,2014,695149,Consumer Services,Real Estate Investment Trusts
PH,Parker-Hannifin Corporation Common Stock,$291.455,1.695,0.585%,37468595591.00,United States,,294597,Capital Goods,Office Equipment/Supplies/Services
PHG,Koninklijke Philips N.V. NY Registry Shares,$43.235,0.105,0.243%,39462056738.00,Netherlands,,359936,Health Care,Biotechnology: Electromedical & Electrotherapeutic Apparatus
PHI,PLDT Inc. Sponsored ADR,$32.72,0.06,0.184%,7067520000.00,Philippines,,48175,Public Utilities,Telecommunications Equipment
PHM,PulteGroup Inc. Common Stock,$47.43,-0.23,-0.483%,12309238023.00,United States,,829964,,
PHR,Phreesia Inc. Common Stock,$60.53,-1.37,-2.213%,3079495407.00,United States,2019,49176,Health Care,Managed Health Care
PII,Polaris Inc. Common Stock,$128.09,4.08,3.29%,7760972331.00,United States,,592531,Consumer Non-Durables,Recreational Products/Toys
PINC,Premier Inc. Class A Common Stock,$39.245,0.585,1.513%,4818509852.00,United States,2013,122207,Health Care,Managed Health Care
PING,Ping Identity Holding Corp. Common Stock,$25.48,0.09,0.354%,2092208791.00,United States,2019,303100,Technology,EDP Services
PINS,Pinterest Inc. Class A Common Stock,$51.79,-0.02,-0.039%,33385326899.00,,2019,3491713,,
PIPR,Piper Sandler Companies Common Stock,$156.03,2.75,1.794%,2815205446.00,United States,,34656,Finance,Investment Bankers/Brokers/Service
PJT,PJT Partners Inc. Class A Common Stock,$83.42,0.54,0.652%,3424823616.00,United States,2015,27827,Finance,Investment Managers
PK,Park Hotels & Resorts Inc. Common Stock ,$19.30,-0.02,-0.104%,4564312874.00,United States,2016,958827,Consumer Services,Real Estate Investment Trusts
PKG,Packaging Corporation of America Common Stock,$140.14,-2.53,-1.773%,13312205507.00,United States,2000,324238,Basic Industries,Paper
PKI,PerkinElmer Inc. Common Stock,$171.10,0.10,0.058%,21592720420.00,United States,,223327,Health Care,Medical Specialities
PKX,POSCO Common Stock,$67.18,-0.72,-1.06%,20322103708.00,South Korea,1994,90290,Basic Industries,Steel/Iron Ore
PLAN,Anaplan Inc. Common Stock,$59.915,-0.895,-1.472%,8758532876.00,United States,2018,437278,Technology,Computer Software: Prepackaged Software
PLD,Prologis Inc. Common Stock,$129.22,-0.16,-0.124%,95526014220.00,United States,,504324,Consumer Services,Real Estate Investment Trusts
PLMR,Palomar Holdings Inc. Common stock,$79.69,-1.01,-1.252%,2022157896.00,United States,2019,17691,Finance,Property-Casualty Insurers
PLNT,Planet Fitness Inc. Common Stock,$79.41,-0.30,-0.376%,6609562388.00,United States,2015,253878,Consumer Services,Other Consumer Services
PLTK,Playtika Holding Corp. Common Stock,$27.45,-0.03,-0.109%,11244459284.00,Israel,2021,167758,Technology,EDP Services
PLTR,Palantir Technologies Inc. Class A Common Stock,$23.33,-0.40,-1.686%,43862198953.00,,2020,31110492,Technology,Retail: Computer Software & Peripheral Equipment
PLUG,Plug Power Inc. Common Stock,$27.095,1.005,3.852%,15562160864.00,United States,1999,13582760,Consumer Durables,Electrical Products
PLXS,Plexus Corp. Common Stock,$92.92,-0.68,-0.726%,2625019827.00,United States,,20486,Technology,Electrical Products
PM,Philip Morris International Inc Common Stock,$95.71,0.06,0.063%,149167958344.00,United States,,1963239,Consumer Non-Durables,Farming/Seeds/Milling
PNC,PNC Financial Services Group Inc. (The) Common Stock,$203.00,1.20,0.595%,86273626299.00,United States,,521727,Finance,Major Banks
PNFP,Pinnacle Financial Partners Inc. Common Stock,$96.51,0.80,0.836%,7345179027.00,United States,,141812,Finance,Major Banks
PNM,PNM Resources Inc. (Holding Co.) Common Stock,$49.655,-0.185,-0.371%,4262130668.00,United States,,365684,Public Utilities,Electric Utilities: Central
PNR,Pentair plc. Ordinary Share,$70.90,-1.51,-2.085%,11759693861.00,Switzerland,,1430606,Capital Goods,Fluid Controls
PNW,Pinnacle West Capital Corporation Common Stock,$66.165,-2.025,-2.97%,7462458430.00,United States,,1739327,Public Utilities,Electric Utilities: Central
PODD,Insulet Corporation Common Stock,$292.934,-0.066,-0.023%,20175497942.00,United States,2007,91194,Health Care,Medical/Dental Instruments
POOL,Pool Corporation Common Stock,$448.365,-4.175,-0.923%,40454361181.00,United States,1995,73515,Consumer Non-Durables,Recreational Products/Toys
POR,Portland General Electric Co Common Stock,$48.77,-0.01,-0.021%,4360304040.00,United States,,127361,Public Utilities,Electric Utilities: Central
POST,Post Holdings Inc. Common Stock,$106.39,-1.21,-1.125%,6777815923.00,United States,2012,180456,Consumer Non-Durables,Specialty Foods
POWI,Power Integrations Inc. Common Stock,$99.20,-0.91,-0.909%,5980827818.00,United States,1997,85944,Technology,Semiconductors
PPBI,Pacific Premier Bancorp Inc,$43.38,0.02,0.046%,4105896091.00,United States,,82838,Finance,Major Banks
PPC,Pilgrim's Pride Corporation Common Stock,$28.875,-0.275,-0.943%,7036130698.00,United States,,153983,Consumer Non-Durables,Meat/Poultry/Fish
PPD,PPD Inc. Common Stock,$47.045,0.145,0.309%,16527629418.00,United States,2020,803602,Health Care,Biotechnology: Pharmaceutical Preparations
PPG,PPG Industries Inc. Common Stock,$150.70,0.22,0.146%,35729640675.00,United States,,502744,Basic Industries,Paints/Coatings
PPL,PPL Corporation Common Stock,$28.51,0.11,0.387%,21941462071.00,United States,,2358437,Public Utilities,Electric Utilities: Central
PRFT,Perficient Inc. Common Stock,$120.59,-2.27,-1.848%,3971184261.00,United States,1999,85078,Technology,EDP Services
PRG,PROG Holdings Inc. Common Stock,$44.73,-1.03,-2.251%,3562733944.00,United States,,65898,Technology,Diversified Commercial Services
PRGO,Perrigo Company plc Ordinary Shares,$46.08,-0.17,-0.368%,6161577108.00,United States,,1310645,Health Care,Biotechnology: Pharmaceutical Preparations
PRGS,Progress Software Corporation Common Stock (DE),$49.09,-0.38,-0.768%,2147920530.00,United States,1991,53560,Technology,Computer Software: Prepackaged Software
PRI,Primerica Inc. Common Stock,$158.93,-0.17,-0.107%,6272946280.00,United States,2010,31858,Finance,Life Insurance
PRK,Park National Corporation Common Stock,$127.18,0.25,0.197%,2077703159.00,United States,,5684,Finance,Major Banks
PRMW,Primo Water Corporation Common Stock,$16.295,-0.055,-0.336%,2613258660.00,Canada,,192272,Consumer Non-Durables,Soft Drinks
PRTA,Prothena Corporation plc Ordinary Shares,$70.36,-2.90,-3.959%,3169538512.00,United States,,175359,Health Care,Biotechnology: Pharmaceutical Preparations
PRU,Prudential Financial Inc. Common Stock,$109.67,1.18,1.088%,42332620000.00,United States,2001,813352,Finance,Life Insurance
PRVA,Privia Health Group Inc. Common Stock,$21.09,-0.38,-1.77%,2230119069.00,United States,2021,125723,Technology,Retail: Computer Software & Peripheral Equipment
PSA,Public Storage Common Stock,$301.69,0.16,0.053%,52864609234.00,United States,,135789,Consumer Services,Real Estate Investment Trusts
PSB,PS Business Parks Inc. (MD) Common Stock,$166.26,0.51,0.308%,4579226358.00,United States,,21113,Consumer Services,Real Estate Investment Trusts
PSEC,Prospect Capital Corporation Common Stock,$8.045,0.075,0.941%,3130514897.00,United States,2004,978861,Finance,Finance/Investors Services
PSFE,Paysafe Limited Common Shares,$7.135,-0.135,-1.857%,5163687846.00,,2021,3009741,Miscellaneous,Business Services
PSMT,PriceSmart Inc. Common Stock,$79.95,-0.18,-0.225%,2461122117.00,United States,,11165,Consumer Services,Department/Specialty Retail Stores
PSN,Parsons Corporation Common Stock,$34.96,0.14,0.402%,3583497189.00,,2019,117744,Capital Goods,Industrial Machinery/Components
PSO,Pearson Plc Common Stock,$10.12,0.06,0.596%,7658498060.00,United Kingdom,,99727,Consumer Services,Books
PSTG,Pure Storage Inc. Class A Common Stock,$25.605,-0.075,-0.292%,7299321870.00,,2015,1424059,Technology,Electronic Components
PSTH,Pershing Square Tontine Holdings Ltd. Class A Common Stock,$19.72,0.02,0.102%,3944001972.00,,2020,1033124,,
PSX,Phillips 66 Common Stock,$81.78,2.48,3.127%,35818773786.00,United States,,1932191,Energy,Integrated oil Companies
PSXP,Phillips 66 Partners LP Common Units representing limited partner interest in the Partnership,$38.4804,0.3404,0.893%,8786620154.00,United States,2013,178220,Energy,Oil & Gas Production
PTC,PTC Inc. Common Stock,$120.59,0.39,0.324%,14155069212.00,United States,,302202,Technology,Computer Software: Prepackaged Software
PTCT,PTC Therapeutics Inc. Common Stock,$36.495,-0.305,-0.829%,2576726738.00,United States,2013,130567,Health Care,Biotechnology: Pharmaceutical Preparations
PTON,Peloton Interactive Inc. Class A Common Stock,$86.11,-1.63,-1.858%,25875826120.00,United States,2019,3210989,Consumer Services,Other Consumer Services
PTR,PetroChina Company Limited Common Stock,$53.38,0.63,1.194%,97696597950.00,China,,150584,Energy,Oil & Gas Production
PTVE,Pactiv Evergreen Inc. Common stock,$12.54,0.04,0.32%,2221557683.00,United States,2020,22203,Consumer Durables,Containers/Packaging
PTY,Pimco Corporate & Income Opportunity Fund,$18.43,-0.12,-0.647%,2103047300.00,United States,2002,147393,Finance,Investment Managers
PUK,Prudential Public Limited Company Common Stock,$41.36,-0.69,-1.641%,56795433049.00,United Kingdom,,356465,Finance,Life Insurance
PVH,PVH Corp. Common Stock,$104.19,-2.81,-2.626%,7434970269.00,United States,,313423,,
PWR,Quanta Services Inc. Common Stock,$113.49,0.10,0.088%,15792399634.00,United States,,330776,Capital Goods,Engineering & Construction
PWSC,PowerSchool Holdings Inc. Class A Common Stock,$23.71,-0.82,-3.343%,4704107437.00,,2021,91747,Technology,Computer Software: Prepackaged Software
PXD,Pioneer Natural Resources Company Common Stock,$191.30,6.64,3.596%,46669365309.00,United States,,2687653,Energy,Oil & Gas Production
PYCR,Paycor HCM Inc. Common Stock,$35.17,-0.79,-2.197%,6134699689.00,United States,2021,71884,Technology,Computer Software: Prepackaged Software
PYPL,PayPal Holdings Inc. Common Stock,$260.975,-2.565,-0.973%,306654015346.00,United States,,2550293,Miscellaneous,Business Services
PZZA,Papa John's International Inc. Common Stock,$125.66,-1.75,-1.374%,4594606228.00,United States,1993,96195,Consumer Services,Restaurants
QCOM,QUALCOMM Incorporated Common Stock,$126.96,-0.88,-0.688%,143210880000.00,United States,1991,4288451,Technology,Computer peripheral equipment
QDEL,Quidel Corporation Common Stock,$138.99,2.78,2.041%,5786537173.00,United States,,713645,Health Care,Biotechnology: In Vitro & In Vivo Diagnostic Substances
QFIN,360 DigiTech Inc. American Depositary Shares,$21.09,1.14,5.714%,3214031661.00,China,2018,1123163,Finance,Finance: Consumer Services
QGEN,Qiagen N.V. Common Shares ,$51.17,0.05,0.098%,11699406460.00,Netherlands,,213719,Health Care,Biotechnology: Biological Products (No Diagnostic Substances)
QLYS,Qualys Inc. Common Stock,$110.7024,-1.9676,-1.746%,4311297330.00,United States,2012,63900,Technology,EDP Services
QRTEA,Qurate Retail Inc. Series A Common Stock ,$10.33,-0.11,-1.054%,4206988445.00,United States,,1498395,Consumer Services,Catalog/Specialty Distribution
QRTEB,Qurate Retail Inc. Series B Common Stock ,$10.44,0.17,1.655%,4251786967.00,United States,,634,Consumer Services,Catalog/Specialty Distribution
QRVO,Qorvo Inc. Common Stock,$166.295,0.965,0.584%,18482280066.00,United States,,380349,Capital Goods,Industrial Machinery/Components
QS,QuantumScape Corporation Class A Common Stock,$23.4799,0.6599,2.892%,9772149734.00,United States,2020,7515309,Capital Goods,Auto Parts:O.E.M.
QSR,Restaurant Brands International Inc. Common Shares,$62.46,0.65,1.052%,19265770635.00,Canada,2014,462220,,
QTWO,Q2 Holdings Inc. Common Stock,$77.00,-2.60,-3.266%,4347723919.00,,2014,87700,Technology,EDP Services
R,Ryder System Inc. Common Stock,$82.915,-0.775,-0.926%,4458637961.00,United States,,165769,Miscellaneous,Rental/Leasing Companies
RACE,Ferrari N.V. Common Shares,$212.53,1.31,0.62%,52600647501.00,,2015,184572,Capital Goods,Auto Manufacturing
RAMP,LiveRamp Holdings Inc. Common Stock,$48.47,0.16,0.331%,3292188258.00,United States,2018,78494,Technology,EDP Services
RARE,Ultragenyx Pharmaceutical Inc. Common Stock,$82.25,-3.20,-3.745%,5579515935.00,United States,2014,148858,Health Care,Biotechnology: Pharmaceutical Preparations
RAVN,Raven Industries Inc. Common Stock,$57.80,0.00,0.00%,2076039419.00,United States,,298289,Capital Goods,Office Equipment/Supplies/Services
RBA,Ritchie Bros. Auctioneers Incorporated Common Stock,$63.75,-0.50,-0.778%,7036180320.00,Canada,,154211,,
RBLX,Roblox Corporation Class A Common Stock,$70.61,-4.19,-5.602%,40611498678.00,,2021,9166090,Technology,EDP Services
RCI,Rogers Communication Inc. Common Stock,$47.27,0.18,0.382%,23867819782.00,Canada,,100614,,
RCII,Rent-A-Center Inc. Common Stock,$55.07,-0.90,-1.608%,3660044552.00,United States,1995,211724,Technology,Diversified Commercial Services
RCL,D/B/A Royal Caribbean Cruises Ltd. Common Stock,$88.07,-0.72,-0.811%,22430918899.00,United States,1993,1747148,Transportation,Hotels/Resorts
RCM,R1 RCM Inc. Common Stock,$23.37,0.11,0.473%,6517201902.00,United States,,372331,Consumer Services,Other Consumer Services
RCUS,Arcus Biosciences Inc. Common Stock,$31.64,-1.39,-4.208%,2258907331.00,,2018,143238,Health Care,Biotechnology: Pharmaceutical Preparations
RDFN,Redfin Corporation Common Stock,$48.485,-1.045,-2.11%,5086678878.00,United States,2017,454442,Finance,Real Estate
RDN,Radian Group Inc. Common Stock,$23.405,0.045,0.193%,4342973124.00,United States,,621258,Finance,Property-Casualty Insurers
RDY,Dr. Reddy's Laboratories Ltd Common Stock,$64.61,-0.88,-1.344%,10716692068.00,India,,45178,Health Care,Biotechnology: Pharmaceutical Preparations
RE,Everest Re Group Ltd. Common Stock,$269.18,3.11,1.169%,10732962188.00,Bermuda,,94416,Finance,Property-Casualty Insurers
REG,Regency Centers Corporation Common Stock,$69.72,-0.22,-0.315%,11843596246.00,United States,1993,310450,Consumer Services,Real Estate Investment Trusts
REGI,Renewable Energy Group Inc. Common Stock,$54.01,0.49,0.916%,2713196023.00,United States,2012,462102,Basic Industries,Major Chemicals
REGN,Regeneron Pharmaceuticals Inc. Common Stock,$554.17,2.15,0.389%,59271462380.00,United States,1991,373413,Health Care,Biotechnology: Pharmaceutical Preparations
RELX,RELX PLC PLC American Depositary Shares (Each representing One Ordinary Share),$29.19,-0.26,-0.883%,56467369560.00,United Kingdom,2015,1144199,Consumer Services,Publishing
RELY,Remitly Global Inc. Common Stock,$39.04,-0.17,-0.434%,6300184198.00,United States,2021,89330,Technology,Computer Software: Prepackaged Software
RERE,AiHuiShou International Co. Ltd. American Depositary Shares (every three of which representing two Class A ordinary shares),$9.08,0.19,2.137%,2021524311.00,,2021,102363,,
RETA,Reata Pharmaceuticals Inc. Class A Common Stock,$97.975,0.245,0.251%,3565055711.00,United States,2016,52059,Health Care,Biotechnology: Pharmaceutical Preparations
REXR,Rexford Industrial Realty Inc. Common Stock,$58.10,-0.24,-0.411%,8384737696.00,United States,2013,351947,Consumer Services,Real Estate Investment Trusts
REYN,Reynolds Consumer Products Inc. Common Stock,$27.55,0.00,0.00%,5778854637.00,United States,2020,76704,Capital Goods,Office Equipment/Supplies/Services
REZI,Resideo Technologies Inc. Common Stock ,$23.77,-0.52,-2.141%,3427228508.00,,2018,245446,Miscellaneous,Diversified Manufacture
RF,Regions Financial Corporation Common Stock,$22.035,0.185,0.847%,21033273630.00,United States,,3432992,Finance,Major Banks
RGA,Reinsurance Group of America Incorporated Common Stock,$119.86,0.56,0.469%,8150112869.00,United States,,75461,Finance,Life Insurance
RGEN,Repligen Corporation Common Stock,$261.35,-10.82,-3.975%,14368285732.00,United States,1986,168405,Health Care,Medical/Dental Instruments
RGLD,Royal Gold Inc. Common Stock,$94.75,-0.04,-0.042%,6219133322.00,United States,,193812,,
RH,RH Common Stock,$646.88,-5.60,-0.858%,13852001752.00,United States,2012,221483,Consumer Services,Other Specialty Stores
RHI,Robert Half International Inc. Common Stock,$109.155,2.015,1.881%,12222089825.00,United States,,277913,Technology,Diversified Commercial Services
RHP,Ryman Hospitality Properties Inc. (REIT),$86.80,1.10,1.284%,4779680366.00,United States,,135898,Consumer Services,Real Estate Investment Trusts
RIG,Transocean Ltd (Switzerland) Common Stock,$3.935,0.095,2.474%,2562235684.00,Switzerland,,9801754,Energy,Oil & Gas Production
RIO,Rio Tinto Plc Common Stock,$68.47,0.34,0.499%,110859768989.00,Australia,2002,1952269,Basic Industries,Steel/Iron Ore
RIOT,Riot Blockchain Inc.  Common Stock ,$26.2416,0.1216,0.466%,2517914821.00,United States,,6093034,Technology,Retail: Computer Software & Peripheral Equipment
RJF,Raymond James Financial Inc. Common Stock,$96.075,0.215,0.224%,44484927327.00,United States,,380029,Finance,Investment Bankers/Brokers/Service
RKT,Rocket Companies Inc. Class A Common Stock,$15.1799,-0.1701,-1.108%,2100990879.00,United States,2020,2181677,Finance,Finance: Consumer Services
RL,Ralph Lauren Corporation Common Stock,$112.945,-4.265,-3.639%,8302513762.00,United States,1997,522170,Consumer Non-Durables,Apparel
RLAY,Relay Therapeutics Inc. Common Stock,$26.8829,0.8829,3.396%,2491913023.00,United States,2020,2444122,Health Care,Biotechnology: Pharmaceutical Preparations
RLGY,Realogy Holdings Corp. Common Stock,$19.10,0.20,1.058%,2226758239.00,United States,2012,378090,Finance,Real Estate
RLI,RLI Corp. Common Stock (DE),$103.575,0.425,0.412%,4684277046.00,United States,,41012,Finance,Property-Casualty Insurers
RLJ,RLJ Lodging Trust Common Shares of Beneficial Interest $0.01 par value,$14.92,0.03,0.201%,2485949139.00,United States,2011,145724,Consumer Services,Real Estate Investment Trusts
RLX,RLX Technology Inc. American Depositary Shares each representing the right to receive one (1) Class A ordinary share,$4.875,0.115,2.416%,7657604029.00,,2021,3957358,Consumer Non-Durables,Farming/Seeds/Milling
RMBS,Rambus Inc. Common Stock,$22.41,-0.25,-1.103%,2440388381.00,United States,1997,134624,Technology,Semiconductors
RMD,ResMed Inc. Common Stock,$255.75,0.76,0.298%,37265643748.00,United States,,194970,Health Care,Medical/Dental Instruments
RNG,RingCentral Inc. Class A Common Stock,$224.54,3.34,1.51%,20547657421.00,,2013,676788,Technology,EDP Services
RNR,RenaissanceRe Holdings Ltd. Common Stock,$148.34,2.38,1.631%,6987613404.00,Bermuda,,220628,Finance,Property-Casualty Insurers
RNST,Renasant Corporation Common Stock,$37.845,0.075,0.199%,2132643408.00,United States,,41604,Finance,Major Banks
RNW,ReNew Energy Global plc Class A Ordinary Shares,$8.915,0.275,3.183%,3572907895.00,United Kingdom,,1025498,,
ROCK,Gibraltar Industries Inc. Common Stock,$71.90,-0.01,-0.014%,2346552846.00,United States,1993,14140,,
ROG,Rogers Corporation Common Stock,$186.80,3.71,2.026%,3498603726.00,United States,,17277,Capital Goods,Industrial Machinery/Components
ROIC,Retail Opportunity Investments Corp. Common Stock (MD),$18.175,0.045,0.248%,2206560702.00,United States,,329980,Consumer Services,Real Estate Investment Trusts
ROK,Rockwell Automation Inc. Common Stock,$302.07,-2.77,-0.909%,35047889845.00,United States,,167074,Capital Goods,Industrial Machinery/Components
ROKU,Roku Inc. Class A Common Stock,$324.89,0.42,0.129%,43357027620.00,United States,2017,1699370,Consumer Services,Television Services
ROL,Rollins Inc. Common Stock,$36.84,0.10,0.272%,18128201044.00,United States,,285513,Technology,Industrial Specialties
ROLL,RBC Bearings Incorporated Common Stock,$217.13,-2.61,-1.188%,6268707250.00,United States,2005,62353,Capital Goods,Metal Fabrications
ROP,Roper Technologies Inc. Common Stock,$453.465,0.115,0.025%,47806023419.00,United States,1992,103681,Capital Goods,Office Equipment/Supplies/Services
ROST,Ross Stores Inc. Common Stock,$108.21,0.30,0.278%,38454150640.00,United States,1985,647535,Consumer Services,Clothing/Shoe/Accessory Stores
RPAI,Retail Properties of America Inc. Class A Common Stock,$13.64,-0.05,-0.365%,2929842933.00,United States,2012,272973,Consumer Services,Real Estate Investment Trusts
RPAY,Repay Holdings Corporation Class A Common Stock,$22.865,-0.425,-1.825%,2071256893.00,United States,2018,76443,Technology,EDP Services
RPD,Rapid7 Inc. Common Stock,$116.17,-1.03,-0.879%,6480365361.00,United States,2015,122127,Technology,Computer Software: Prepackaged Software
RPM,RPM International Inc. Common Stock,$78.9694,-0.8306,-1.041%,10243571473.00,United States,,416928,Basic Industries,Paints/Coatings
RPRX,Royalty Pharma plc Class A Ordinary Shares ,$35.71,0.20,0.563%,15248380260.00,United States,2020,513742,Health Care,Biotechnology: Pharmaceutical Preparations
RQI,Cohen & Steers Quality Income Realty Fund Inc Common Shares,$15.38,-0.04,-0.259%,2064660862.00,United States,2002,206109,Finance,Trusts Except Educational Religious and Charitable
RRC,Range Resources Corporation Common Stock,$23.36,0.20,0.864%,5834716225.00,United States,,2935683,Energy,Oil & Gas Production
RRR,Red Rock Resorts Inc. Class A Common Stock,$54.02,-0.77,-1.405%,6285734356.00,United States,2016,167977,Consumer Services,Recreational Products/Toys
RRX,Regal Rexnord Corporation Common Stock,$135.19,-4.32,-3.097%,22007332432.00,United States,,685566,Consumer Durables,Metal Fabrications
RS,Reliance Steel & Aluminum Co. Common Stock (DE),$141.97,-0.69,-0.484%,9012709336.00,United States,1994,73759,Basic Industries,Steel/Iron Ore
RSG,Republic Services Inc. Common Stock,$125.68,0.63,0.504%,40012094851.00,United States,1998,230731,Public Utilities,Environmental Services
RSI,Rush Street Interactive Inc. Class A Common Stock,$20.91,0.22,1.063%,4583001295.00,,2020,857945,Consumer Services,Services-Misc. Amusement & Recreation
RSKD,Riskified Ltd. Class A Ordinary Shares,$20.66,0.59,2.94%,3256542789.00,,2021,333235,,
